Measurements and Geometry,Linear Motion,Speed and Velocity,,Yes,Covered,,,Speed and Velocity,Yes,YES,YES,"Explain the terms distance, displacement, speed, velocity and acceleration in real-life situations",Determine velocity and acceleration in different situations,,,
Measurements and Geometry,Linear Motion,Relative Speeds,Relative Speeds of Objects Moving in the Same Direction,Yes,Covered,,,Relative Speeds of Objects Moving in the Same Direction,Yes,YES,YES,Determine relative speed of two moving bodies in different situations,,,,
Measurements and Geometry,Linear Motion,Relative Speeds,Relative Speeds of Objects Moving in Different Directions,Yes,Covered,,,Relative Speeds of Objects Moving in Different Directions,Yes,YES,YES,Determine relative speed of two moving bodies in different situations,,,,
Measurements and Geometry,Linear Motion,Acceleration,,Yes,Covered,,,Accelaration,Yes,YES,YES,"Explain the terms distance, displacement, speed, velocity and acceleration in real-life situations",Determine velocity and acceleration in different situations,,,
Measurements and Geometry,Linear Motion,Displacement-Time Graphs,,Yes,Covered,,,Displacement-Time Graphs,Yes,NO,NO,Draw a displacement-time graph of different situations,Interpret displacement-time graph in different situations,,,
Measurements and Geometry,Linear Motion,Velocity-Time Graphs,,Yes,Covered,,,Velocity-Time Graphs,Yes,YES,YES,Draw a velocity-time graph from given tables in different situations,Interpret velocity-time graph in different situations,,,
Measurements and Geometry,Linear Motion,Linear Motion in Real-Life,,Yes,Covered,,,Linear Motion in Real-Life,Yes,NO,NO,Appreciate use of linear motion in real-life situations,,,,
Statistics and Probability,Statistics 1,Introduction to Statistics,Sources of Data,Yes,Covered,,,Sources of Data,Yes,YES,YES,Collect data from real-life sources,"Promote data collection, organisation and representation for informed decision making",,,
Statistics and Probability,Statistics 1,Introduction to Statistics,Methods of Data Collection,Yes,Covered,,,Methods of Data Collection,Yes,YES,YES,Collect data from real-life sources,"Promote data collection, organisation and representation for informed decision making",,,
Statistics and Probability,Statistics 1,Ungrouped Data,Frequency Distribution Tables,Yes,Covered,,,Frequency Distribution Tables,Yes,YES,YES,Draw a frequency distribution table for grouped and ungrouped data,,,,
Statistics and Probability,Statistics 1,Ungrouped Data,Mean,Yes,Covered,,,Mean,Yes,YES,YES,"Determine mean, mode and median of grouped and ungrouped data",,,,
Statistics and Probability,Statistics 1,Ungrouped Data,Median,Yes,Covered,,,Median,Yes,YES,YES,"Determine mean, mode and median of grouped and ungrouped data",,,,
Statistics and Probability,Statistics 1,Ungrouped Data,Mode,Yes,Covered,,,Mode,Yes,YES,YES,"Determine mean, mode and median of grouped and ungrouped data",,,,
Statistics and Probability,Statistics 1,Grouped Data,Frequency Distribution Tables Grouped,Yes,Covered,Add more examples,,Frequency Distribution Tables Grouped,Yes,YES,YES,Draw a frequency distribution table for grouped and ungrouped data,,,,
Statistics and Probability,Statistics 1,Grouped Data,Mean Grouped,Yes,Covered,,,Mean Grouped,Yes,YES,YES,"Determine mean, mode and median of grouped and ungrouped data",,,,
Statistics and Probability,Statistics 1,Grouped Data,Median Grouped,Yes,Covered,Add more examples,,Median Grouped,Yes,YES,YES,"Determine mean, mode and median of grouped and ungrouped data",,,,
Statistics and Probability,Statistics 1,Grouped Data,Mode Grouped,Yes,Covered,,,Mode Grouped,Yes,YES,YES,"Determine mean, mode and median of grouped and ungrouped data",,,,
Statistics and Probability,Statistics 1,Histograms and Frequency Polygons,,Yes,Covered,,,Histograms and Frequency Polygons,Yes,YES,YES,Represent data using histograms and frequency polygons,Interpret data from histograms and frequency polygons,,,
Statistics and Probability,Statistics 1,Interpretation of Data,,Yes,Covered,,,Interpretation of Data,Yes,YES,YES,Represent data using histograms and frequency polygons,Interpret data from histograms and frequency polygons,"Promote data collection, organisation and representation for informed decision making",,
Statistics and Probability,Statistics 1,Statistics in Real-Life,,Yes,Covered,,,Statistics in Real-Life,Yes,YES,YES,Collect data from real-life sources,"Promote data collection, organisation and representation for informed decision making",,,
Statistics and Probability,Probability 1,Introduction to Probability,,Yes,Covered,,,Introduction to Probability,Yes,YES,YES,Perform experiments involving probabilities in different situations,Identify the range of probability in different situations,Appreciate the application of probability in real-life situations,,
Statistics and Probability,Probability 1,Probability Spaces,,Yes,Partially Covered,Visual example of probability space / event space (e.g. with dice roll). You could re-use (with attribution) material from: https://saylordotorg.github.io/text_introductory-statistics/s07-01-sample-spaces-events-and-their.html,Murunga,Probability Spaces,No,NO,NO,Generate probability space of different events,,,,
Statistics and Probability,Probability 1,Mutually Exclusive Events,,Yes,Covered,,,Mutually Exclusive Events,Yes,YES,YES,Determine the probability of mutually exclusive and independent events,,,,
Statistics and Probability,Probability 1,Independent Events,,Yes,Covered,,,Independent Events,Yes,YES,YES,Determine the probability of mutually exclusive and independent events,Determine the probability of independent events using tree diagrams,,,
Statistics and Probability,Probability 1,Laws of Probability,Addition Rule,Yes,Covered,,,Addition Rule,Yes,YES,YES,Apply the laws of probability in different situations,,,,
Statistics and Probability,Probability 1,Laws of Probability,Multiplication Rule,Yes,Covered,,,Multiplication Rule,Yes,NO,NO,Apply the laws of probability in different situations,,,,
Statistics and Probability,Probability 1,Probability Using Tree Diagrams,,Yes,Covered,Would be good to use tree diagrams visually in the answers,Ben,Probability Using Tree Diagrams,Yes,YES,YES,Determine the probability of independent events using tree diagrams,,,,
Statistics and Probability,Probability 1,Probability in Real-Life,,Yes,Covered,,,Probability in Real-Life,Yes,YES,YES,Identify the range of probability in different situations,Appreciate the application of probability in real-life situations,,,